{
  "version": 1,
  "level": 51,
  "cefr": "B2",
  "passages": [
    {
      "id": "L051-P001",
      "topic": "comprehensive training audit",
      "style": "workplace article",
      "setting": "training department",
      "tone": "methodical",
      "targetWords": [
        "comprehensive",
        "attendance",
        "validate",
        "precisely",
        "audit",
        "completion",
        "reliably",
        "flexible",
        "adequate",
        "motivated",
        "prospect",
        "consensus",
        "demanding",
        "reminder",
        "trainer",
        "modest",
        "outlook",
        "cooperation",
        "analyst",
        "respected"
      ],
      "wordCount": 257,
      "text": "A training department conducted a comprehensive audit of its professional development program after several teams reported uneven results. Attendance records were checked first so the review could distinguish enrolled staff from people who actually completed each course. The analyst used a simple method to validate dates, scores, and completion status against source files. Every calculation had to be recorded precisely enough for another reviewer to repeat it. Trainers were asked about course length, examples, and support materials. Some sessions were demanding, while others needed more practical exercises. The department wanted a flexible program, but flexibility could not mean inconsistent standards. A respected trainer suggested using the same core assessment while allowing different examples for each role. The group reached consensus that completion should require adequate practice as well as attendance. Automated reminders were added before deadlines, and managers were encouraged to keep employees motivated without pressuring them unnecessarily. A modest redesign improved navigation through the course portal. Data exports were tested repeatedly until they worked reliably. Cooperation between human resources, instructors, and team leads helped explain several missing records. The final outlook was positive because most problems came from process gaps rather than poor learning. The audit showed that training quality depends on accurate records, useful evidence, clear expectations, and a review process that can identify where support should improve. A reminder was added before every reassessment window, and the prospect of a shorter refresher course was documented for the next review. Managers also compared participation by team so low attendance could be investigated rather than ignored."
    },
    {
      "id": "L051-P002",
      "topic": "childcare center schedule",
      "style": "community article",
      "setting": "childcare center",
      "tone": "caring",
      "targetWords": [
        "childcare",
        "attendance",
        "courtesy",
        "flexible",
        "tender",
        "reassuring",
        "adequate",
        "reminder",
        "completion",
        "nicely",
        "cope",
        "heartfelt",
        "consensus",
        "cooperation",
        "rental",
        "closure",
        "assure",
        "leftover",
        "stack",
        "neat"
      ],
      "wordCount": 265,
      "text": "A community childcare center reviewed its daily schedule after families asked for clearer information about drop off, meals, rest, and pickup. Attendance was recorded at the entrance, and a reminder system notified staff when an authorized pickup plan changed. The center wanted to remain flexible because families had different work hours, but staffing still had to be adequate throughout the day. Courtesy at reception mattered, especially when parents were rushed or worried. A tender response to an upset child could be reassuring without promising something staff could not provide. The center used a rental hall for one weekly activity while repairs were completed in the main room. Toys were stored in a neat stack only when that arrangement was safe and easy for children to reach. Leftover food followed the center food safety procedure rather than being reused casually. If severe weather forced a closure, families received the same message through several channels. Activities included enough transition time so children could cope with changes without being hurried. A heartfelt note from several parents praised the calmer routine. Staff reached consensus on a simpler sign in process. Cooperation between teachers and families improved after the update. Each daily checklist ended with completion of room checks, cleaning, and notes for the next shift. The schedule did not solve every challenge, but it made responsibilities clearer and helped the day run more nicely for children, families, and staff. Staff could also assure families that changes would be announced through the same channel. A monthly review compared attendance patterns with staffing so busy days could be prepared for earlier."
    },
    {
      "id": "L051-P003",
      "topic": "materials diffusion experiment",
      "style": "science article",
      "setting": "college laboratory",
      "tone": "analytical",
      "targetWords": [
        "diffusion",
        "mixture",
        "scattering",
        "axis",
        "deviation",
        "pascal",
        "functional",
        "silicone",
        "chloride",
        "pulse",
        "detect",
        "validate",
        "precisely",
        "comprehensive",
        "reliably",
        "adequate",
        "subtle",
        "enhance",
        "conversion",
        "transmission"
      ],
      "wordCount": 252,
      "text": "A college laboratory used a materials experiment to demonstrate diffusion, scattering, and measurement. Students prepared a safe mixture and observed how one colored substance spread through liquid over time. A camera aligned with a fixed axis captured images at regular intervals. The instructor explained that any deviation in camera position could affect the comparison. Pressure was expressed in pascal units during a separate demonstration, while a silicone seal helped keep the container closed. Chloride appeared only as a common chemistry term in the reference material. A light pulse traveled through a sensor path so students could study transmission and signal conversion. The equipment had to remain functional throughout the trial. Small changes were subtle, so students used software to enhance contrast without altering the original measurements. Every result needed to be detected, recorded, and validated precisely. The class repeated measurements until the pattern appeared reliably. A comprehensive method included temperature, timing, sample size, and calibration notes. Students discussed whether the data were adequate to support a conclusion or whether another trial was needed. The experiment showed that visual results can be persuasive, but careful measurement is still necessary. Diffusion and scattering depend on conditions, and even a simple classroom setup can produce misleading results if alignment, timing, or recording changes between trials. A second detector was used to detect weak signals, and students had to validate its calibration before accepting the measurements. Comparing both sensors helped reveal whether the observed difference came from the sample or the instrument. Results were archived afterward."
    },
    {
      "id": "L051-P004",
      "topic": "rental apartment maintenance",
      "style": "housing article",
      "setting": "apartment building",
      "tone": "practical",
      "targetWords": [
        "rental",
        "closure",
        "drain",
        "bolt",
        "silicone",
        "stack",
        "mop",
        "wipe",
        "leftover",
        "adequate",
        "reliably",
        "courtesy",
        "compensation",
        "alter",
        "conversion",
        "functional",
        "reminder",
        "completion",
        "assure",
        "outlook"
      ],
      "wordCount": 255,
      "text": "A rental apartment building scheduled a maintenance week to repair several small problems before they became larger ones. The property manager sent every resident a reminder explaining when workers might need access and how to report concerns. One blocked drain was cleared, loose cabinet hardware received a new bolt, and worn silicone around a sink was replaced. Cleaning staff used a mop and wipe routine after repairs, while leftover materials were labeled for future use. Supplies were stored in a safe stack rather than left in hallways. The manager wanted to assure residents that essential services would remain functional during the work. A brief water closure was required, but notice was given in advance and the interruption ended on schedule. Contractors were expected to act with courtesy inside occupied homes. One tenant requested compensation for damage caused during an earlier repair, and the claim was reviewed separately. A planned storage conversion was postponed because the ventilation was not adequate. Workers could alter minor fittings only when the work order allowed it. Completion records were checked so repairs could be traced reliably. The overall outlook improved once recurring leaks were documented instead of treated as unrelated incidents. The maintenance week showed that rental management depends on communication, careful records, and timely small repairs. Preventing avoidable damage is usually easier than dealing with a major failure later. Before closing each work order, supervisors photographed the repair and asked the resident to confirm access had been restored. This extra record reduced confusion when several apartments needed similar work."
    },
    {
      "id": "L051-P005",
      "topic": "marathon preparation program",
      "style": "sports article",
      "setting": "community training track",
      "tone": "encouraging",
      "targetWords": [
        "marathon",
        "trainer",
        "pulse",
        "cope",
        "flexible",
        "demanding",
        "motivated",